co_entidade,code_muni,no_entidade,mat_infantil,mat_fundamental,mat_medio,nu_funcionarios,endereco,SearchedAddress,PrecisionDepth,MatchedAddress,geocode_engine,lon,lat,year,qt_funcionarios,n
33075883,3304557,CE VIRIATO CORREA,0,0,1,NA,"RUA AMERICO DA ROCHA, 1596 HONORIO GURGEL. 21555-300 Rio de Janeiro - RJ.","RUA AMERICO DA ROCHA, 1596 HONORIO GURGEL. 21555-300 Rio de Janeiro - RJ.",inep,"RUA AMERICO DA ROCHA, 1596 HONORIO GURGEL. 21555-300 Rio de Janeiro - RJ.",inep,-43.3588726,-22.8497638,2018,33,1
33075891,3304557,CE WALDEMIRO POTSCH,0,0,1,NA,"RUA RIACHO DOCE, 0 OSWALDO CRUZ. 21340-340 Rio de Janeiro - RJ.","RUA RIACHO DOCE, 0 OSWALDO CRUZ. 21340-340 Rio de Janeiro - RJ.",inep,"RUA RIACHO DOCE, 0 OSWALDO CRUZ. 21340-340 Rio de Janeiro - RJ.",inep,-43.3551877,-22.8705141,2018,21,1
33076049,3304557,0515054 ESCOLA MUNICIPAL CARDEAL ARCOVERDE,1,1,0,NA,"RUA AGOSTINHO BARBALHO, 401 MADUREIRA. 21310-130 Rio de Janeiro - RJ.","RUA AGOSTINHO BARBALHO, 401 MADUREIRA. 21310-130 Rio de Janeiro - RJ.",inep,"RUA AGOSTINHO BARBALHO, 401 MADUREIRA. 21310-130 Rio de Janeiro - RJ.",inep,-43.3434442,-22.8762493,2018,44,1
33076073,3304557,0515023 ESCOLA MUNICIPAL CONDE AFONSO CELSO,1,1,0,NA,"RUA IVINHEIMA, 15 BENTO RIBEIRO. 21550-390 Rio de Janeiro - RJ.","RUA IVINHEIMA, 15 BENTO RIBEIRO. 21550-390 Rio de Janeiro - RJ.",inep,"RUA IVINHEIMA, 15 BENTO RIBEIRO. 21550-390 Rio de Janeiro - RJ.",inep,-43.3572241,-22.8595115,2018,56,1
33076243,3304557,0515012 ESCOLA MUNICIPAL MARIO PENNA DA ROCHA,1,1,0,NA,"RUA AMERICO DA ROCHA, 1596 HONORIO GURGEL. 21555-300 Rio de Janeiro - RJ.","RUA AMERICO DA ROCHA, 1596 HONORIO GURGEL. 21555-300 Rio de Janeiro - RJ.",inep,"RUA AMERICO DA ROCHA, 1596 HONORIO GURGEL. 21555-300 Rio de Janeiro - RJ.",inep,-43.3588376,-22.849687,2018,51,1
33076251,3304557,0515055 ESCOLA MUNICIPAL MINISTRO EDGARD ROMERO,0,1,0,NA,"AV MINISTRO EDGARD ROMERO, 31 MADUREIRA. 21350-301 Rio de Janeiro - RJ.","AV MINISTRO EDGARD ROMERO, 31 MADUREIRA. 21350-301 Rio de Janeiro - RJ.",inep,"AV MINISTRO EDGARD ROMERO, 31 MADUREIRA. 21350-301 Rio de Janeiro - RJ.",inep,-43.3380652,-22.8753617,2018,70,1
33076278,3304557,0515041 ESCOLA MUNICIPAL OSWALDO TEIXEIRA,0,1,0,NA,"RUA MILAO, 95 QUINTINO BOCAIUVA. 21311-430 Rio de Janeiro - RJ.","RUA MILAO, 95 QUINTINO BOCAIUVA. 21311-430 Rio de Janeiro - RJ.",inep,"RUA MILAO, 95 QUINTINO BOCAIUVA. 21311-430 Rio de Janeiro - RJ.",inep,-43.32180927,-22.89476849,2018,59,1
33076472,3304557,0515019 ESCOLA MUNICIPAL WALDEMIRO POTSCH,1,1,0,NA,"R RIACHO DOCE, SNº OSVALDO CRUZ. 21340-340 Rio de Janeiro - RJ.","R RIACHO DOCE, SNº OSVALDO CRUZ. 21340-340 Rio de Janeiro - RJ.",inep,"R RIACHO DOCE, SNº OSVALDO CRUZ. 21340-340 Rio de Janeiro - RJ.",inep,-43.3551211,-22.8704847,2018,39,1
33076502,3304557,ESCOLA TECNICA ESTADUAL VISCONDE DE MAUA,0,0,1,NA,"RUA JOAO VICENTE, 1775 MARECHAL HERMES. 21610-210 Rio de Janeiro - RJ.","RUA JOAO VICENTE, 1775 MARECHAL HERMES. 21610-210 Rio de Janeiro - RJ.",inep,"RUA JOAO VICENTE, 1775 MARECHAL HERMES. 21610-210 Rio de Janeiro - RJ.",inep,-43.37525,-22.85925,2018,253,2
33076910,3304557,0734502 CIEP JOAO BATISTA DOS SANTOS,1,1,0,NA,"RUA EDGARD WERNECK, 1565 CIDADE DE DEUS. 22763-011 Rio de Janeiro - RJ.","RUA EDGARD WERNECK, 1565 CIDADE DE DEUS. 22763-011 Rio de Janeiro - RJ.",inep,"RUA EDGARD WERNECK, 1565 CIDADE DE DEUS. 22763-011 Rio de Janeiro - RJ.",inep,-43.3595581,-22.9470493,2018,47,1
33077096,3304557,CE ALBERTO PASQUALINI,0,0,1,NA,"PRACA ALBERT SABIN, 12 PECHINCHA. 22740-170 Rio de Janeiro - RJ.","PRACA ALBERT SABIN, 12 PECHINCHA. 22740-170 Rio de Janeiro - RJ.",inep,"PRACA ALBERT SABIN, 12 PECHINCHA. 22740-170 Rio de Janeiro - RJ.",inep,-43.365384,-22.9319709,2018,11,1
33077118,3304557,CE CARLOS LACERDA,0,0,1,NA,"AVENIDA NELSON CARDOSO 1221 FDS, 1221 TAQUARA. 22730-001 Rio de Janeiro - RJ.","AVENIDA NELSON CARDOSO 1221 FDS, 1221 TAQUARA. 22730-001 Rio de Janeiro - RJ.",inep,"AVENIDA NELSON CARDOSO 1221 FDS, 1221 TAQUARA. 22730-001 Rio de Janeiro - RJ.",inep,-43.3715934,-22.9227379,2018,30,1
33077142,3304557,CE MAHATMA GANDHI,0,0,1,NA,"RUA JOSE PERROTA, 31 CURICICA. 22710-440 Rio de Janeiro - RJ.","RUA JOSE PERROTA, 31 CURICICA. 22710-440 Rio de Janeiro - RJ.",inep,"RUA JOSE PERROTA, 31 CURICICA. 22710-440 Rio de Janeiro - RJ.",inep,-43.39065,-22.9505,2018,30,1
33077150,3304557,CE CARDEAL DOM EUGENIO DE ARAUJO SALES,0,0,1,NA,"RUA EDGAR WERNECK, 1565 CIDADE DE DEUS. 22763-011 Rio de Janeiro - RJ.","RUA EDGAR WERNECK, 1565 CIDADE DE DEUS. 22763-011 Rio de Janeiro - RJ.",inep,"RUA EDGAR WERNECK, 1565 CIDADE DE DEUS. 22763-011 Rio de Janeiro - RJ.",inep,-43.3595492,-22.9470635,2018,35,1
33077169,3304557,CE EUNICE WEAVER,0,0,1,NA,"RUA TRIBUNA, 47 TAQUARA. 22715-120 Rio de Janeiro - RJ.","RUA TRIBUNA, 47 TAQUARA. 22715-120 Rio de Janeiro - RJ.",inep,"RUA TRIBUNA, 47 TAQUARA. 22715-120 Rio de Janeiro - RJ.",inep,-43.3841771,-22.9243997,2018,33,1
33077177,3304557,CE PRESIDENTE JOAO GOULART,0,0,1,NA,"RUA MAMORE, 78 FREGUESIA JACAREPAGUA. 22760-080 Rio de Janeiro - RJ.","RUA MAMORE, 78 FREGUESIA JACAREPAGUA. 22760-080 Rio de Janeiro - RJ.",inep,"RUA MAMORE, 78 FREGUESIA JACAREPAGUA. 22760-080 Rio de Janeiro - RJ.",inep,-43.34255,-22.9383,2018,41,1
33077371,3304557,CE ALINA DE BRITO,0,0,1,NA,"RUA FREI LUIZ ALEVATO, 0 TAQUARA. 22710-320 Rio de Janeiro - RJ.","RUA FREI LUIZ ALEVATO, 0 TAQUARA. 22710-320 Rio de Janeiro - RJ.",inep,"RUA FREI LUIZ ALEVATO, 0 TAQUARA. 22710-320 Rio de Janeiro - RJ.",inep,-43.3697143,-22.9352952,2018,39,1
33077436,3304557,CE DESEMBARGADOR NEY PALMEIRO,0,0,1,NA,"RUA HUGO THOMPSON NOGUEIRA, 0 CAMORIM. 22780-290 Rio de Janeiro - RJ.","RUA HUGO THOMPSON NOGUEIRA, 0 CAMORIM. 22780-290 Rio de Janeiro - RJ.",inep,"RUA HUGO THOMPSON NOGUEIRA, 0 CAMORIM. 22780-290 Rio de Janeiro - RJ.",inep,-43.408528,-22.9634083,2018,6,1
33077495,3304557,CE GENERAL CARLOS CAETANO MIRAGAYA,0,0,1,NA,"RUA SALINOPOLIS, 155 TAQUARA. 22720-000 Rio de Janeiro - RJ.","RUA SALINOPOLIS, 155 TAQUARA. 22720-000 Rio de Janeiro - RJ.",inep,"RUA SALINOPOLIS, 155 TAQUARA. 22720-000 Rio de Janeiro - RJ.",inep,-43.3868431,-22.9176384,2018,20,1
33077509,3304557,CE HONDURAS,0,0,1,NA,"PRACA BARAO DA TAQUARA, 12 PRACA SECA. 21321-010 Rio de Janeiro - RJ.","PRACA BARAO DA TAQUARA, 12 PRACA SECA. 21321-010 Rio de Janeiro - RJ.",inep,"PRACA BARAO DA TAQUARA, 12 PRACA SECA. 21321-010 Rio de Janeiro - RJ.",inep,-43.3526837,-22.8968485,2018,20,1
33077525,3304557,CE MARECHAL CANROBERT PEREIRA DA COSTA,0,0,1,NA,"RUA JOSE SILVA, 155 PECHINCHA. 22743-080 Rio de Janeiro - RJ.","RUA JOSE SILVA, 155 PECHINCHA. 22743-080 Rio de Janeiro - RJ.",inep,"RUA JOSE SILVA, 155 PECHINCHA. 22743-080 Rio de Janeiro - RJ.",inep,-43.3511238,-22.9325586,2018,18,1
33077568,3304557,CE ROSA DO POVO,0,0,1,NA,"RUA BOGARI, 65 TAQUARA. 22723-625 Rio de Janeiro - RJ.","RUA BOGARI, 65 TAQUARA. 22723-625 Rio de Janeiro - RJ.",inep,"RUA BOGARI, 65 TAQUARA. 22723-625 Rio de Janeiro - RJ.",inep,-43.3801371,-22.913815,2018,43,1
33077673,3304557,0716027 ESCOLA MUNICIPAL 25 DE ABRIL,0,1,0,NA,"RUA MAMORE, 78 FREGUESIA. 22760-080 Rio de Janeiro - RJ.","RUA MAMORE, 78 FREGUESIA. 22760-080 Rio de Janeiro - RJ.",inep,"RUA MAMORE, 78 FREGUESIA. 22760-080 Rio de Janeiro - RJ.",inep,-43.3425461,-22.9383148,2018,74,1
33077860,3304557,0716040 ESCOLA MUNICIPAL EUNICE WEAVER,0,1,0,NA,"RUA TRIBUNA, 47 JACAREPAGUA. 22715-120 Rio de Janeiro - RJ.","RUA TRIBUNA, 47 JACAREPAGUA. 22715-120 Rio de Janeiro - RJ.",inep,"RUA TRIBUNA, 47 JACAREPAGUA. 22715-120 Rio de Janeiro - RJ.",inep,-43.3841,-22.9244,2018,66,1
33077886,3304557,0716007 ESCOLA MUNICIPAL FINLANDIA,0,1,0,NA,"AV CANAL DO RIO CACAMBE, 392 JACAREPAGUA. 22783-020 Rio de Janeiro - RJ.","AV CANAL DO RIO CACAMBE, 392 JACAREPAGUA. 22783-020 Rio de Janeiro - RJ.",inep,"AV CANAL DO RIO CACAMBE, 392 JACAREPAGUA. 22783-020 Rio de Janeiro - RJ.",inep,-43.41009,-22.9718483,2018,36,1
33077916,3304557,0716045 ESCOLA MUNICIPAL GENERAL CARLOS CAETANO MIRAGAYA,0,1,0,NA,"R SALINOPOLIS, 155 TAQUARA. 22720-000 Rio de Janeiro - RJ.","R SALINOPOLIS, 155 TAQUARA. 22720-000 Rio de Janeiro - RJ.",inep,"R SALINOPOLIS, 155 TAQUARA. 22720-000 Rio de Janeiro - RJ.",inep,-43.3869,-22.9177,2018,54,1
33077967,3304557,0716059 ESCOLA MUNICIPAL HONDURAS,0,1,0,NA,"PRACA BARAO DE TAQUARA, 12 PRACA SECA. 21321-010 Rio de Janeiro - RJ.","PRACA BARAO DE TAQUARA, 12 PRACA SECA. 21321-010 Rio de Janeiro - RJ.",inep,"PRACA BARAO DE TAQUARA, 12 PRACA SECA. 21321-010 Rio de Janeiro - RJ.",inep,-43.3527182321995,-22.8967900760472,2018,68,1
33077991,3304557,0716003 ESCOLA MUNICIPAL JORNALISTA CAMPOS RIBEIRO,0,1,0,NA,"RUA HUGO THOMPSON NOGUEIRA, S/Nº CAMORIM. JACAREPAGUA. 22780-290 Rio de Janeiro - RJ.","RUA HUGO THOMPSON NOGUEIRA, S/Nº CAMORIM. JACAREPAGUA. 22780-290 Rio de Janeiro - RJ.",inep,"RUA HUGO THOMPSON NOGUEIRA, S/Nº CAMORIM. JACAREPAGUA. 22780-290 Rio de Janeiro - RJ.",inep,-43.40851,-22.96353,2018,48,1
33078033,3304557,0716044 ESCOLA MUNICIPAL JUAN MONTALVO,1,1,0,NA,"AV NELSON CARDOSO, 1221 FUNDOS. TAQUARA. 22730-001 Rio de Janeiro - RJ.","AV NELSON CARDOSO, 1221 FUNDOS. TAQUARA. 22730-001 Rio de Janeiro - RJ.",inep,"AV NELSON CARDOSO, 1221 FUNDOS. TAQUARA. 22730-001 Rio de Janeiro - RJ.",inep,-43.3715206,-22.9228,2018,45,1
33078190,3304557,0716048 ESCOLA MUNICIPAL NELSON RODRIGUES,0,1,0,NA,"RUA FREI LUIS ALEVATO, S/N TAQUARA. 22710-325 Rio de Janeiro - RJ.","RUA FREI LUIS ALEVATO, S/N TAQUARA. 22710-325 Rio de Janeiro - RJ.",inep,"RUA FREI LUIS ALEVATO, S/N TAQUARA. 22710-325 Rio de Janeiro - RJ.",inep,-43.3698101,-22.9352211,2018,71,1
33078270,3304557,0716046 ESCOLA MUNICIPAL PROFESSORA FELICIDADE DE MOURA CASTRO,0,1,0,NA,"R MOACIR CAMPOS, SEM Nº PECHINCHA. 22740-190 Rio de Janeiro - RJ.","R MOACIR CAMPOS, SEM Nº PECHINCHA. 22740-190 Rio de Janeiro - RJ.",inep,"R MOACIR CAMPOS, SEM Nº PECHINCHA. 22740-190 Rio de Janeiro - RJ.",inep,-43.36537006,-22.93196663,2018,29,1
33078335,3304557,0716052 ESCOLA MUNICIPAL ROSA DO POVO,1,1,0,NA,"RUA BOGARI, 65 JACAREPAGUA. 22725-030 Rio de Janeiro - RJ.","RUA BOGARI, 65 JACAREPAGUA. 22725-030 Rio de Janeiro - RJ.",inep,"RUA BOGARI, 65 JACAREPAGUA. 22725-030 Rio de Janeiro - RJ.",inep,-43.3800875,-22.9137338,2018,43,1
33078378,3304557,0716029 ESCOLA MUNICIPAL VIRGILIO VARZEA,1,1,0,NA,"RUA JOSE SILVA, 155 PECHINCHA. 22743-080 Rio de Janeiro - RJ.","RUA JOSE SILVA, 155 PECHINCHA. 22743-080 Rio de Janeiro - RJ.",inep,"RUA JOSE SILVA, 155 PECHINCHA. 22743-080 Rio de Janeiro - RJ.",inep,-43.3512,-22.9325,2018,33,1
33079668,3304557,CE BARONESA DE SAAVEDRA,0,0,1,NA,"RUA MARECHAL FALCAO DA FROTA, 0 REALENGO. 21735-662 Rio de Janeiro - RJ.","RUA MARECHAL FALCAO DA FROTA, 0 REALENGO. 21735-662 Rio de Janeiro - RJ.",inep,"RUA MARECHAL FALCAO DA FROTA, 0 REALENGO. 21735-662 Rio de Janeiro - RJ.",inep,-43.43898919999999,-22.8703053,2018,22,1
33079714,3304557,CE ENGENHEIRO JOAO THOME,0,0,1,NA,"RUA CABO JOSE DA CONCEICAO, 135 PADRE MIGUEL. 21720-520 Rio de Janeiro - RJ.","RUA CABO JOSE DA CONCEICAO, 135 PADRE MIGUEL. 21720-520 Rio de Janeiro - RJ.",inep,"RUA CABO JOSE DA CONCEICAO, 135 PADRE MIGUEL. 21720-520 Rio de Janeiro - RJ.",inep,-43.4468786,-22.867077,2018,27,1
33079790,3304557,CE MARECHAL ALCIDES ETCHEGOYEN,0,0,1,NA,"RUA BIARRITZ, 0 SN. BANGU. 21870-190 Rio de Janeiro - RJ.","RUA BIARRITZ, 0 SN. BANGU. 21870-190 Rio de Janeiro - RJ.",inep,"RUA BIARRITZ, 0 SN. BANGU. 21870-190 Rio de Janeiro - RJ.",inep,-43.4598341,-22.8720926,2018,9,1
33079820,3304557,CE MOACYR PADILHA,0,0,1,NA,"RUA GENERAL GOMES DE CASTRO, 30 PADRE MIGUEL. 21721-000 Rio de Janeiro - RJ.","RUA GENERAL GOMES DE CASTRO, 30 PADRE MIGUEL. 21721-000 Rio de Janeiro - RJ.",inep,"RUA GENERAL GOMES DE CASTRO, 30 PADRE MIGUEL. 21721-000 Rio de Janeiro - RJ.",inep,-43.450653,-22.868778,2018,30,1
33079900,3304557,CE RAMIZ GALVAO,0,0,1,NA,"PRACA RICARDO GONCALVES, 46 REALENGO. 21750-420 Rio de Janeiro - RJ.","PRACA RICARDO GONCALVES, 46 REALENGO. 21750-420 Rio de Janeiro - RJ.",inep,"PRACA RICARDO GONCALVES, 46 REALENGO. 21750-420 Rio de Janeiro - RJ.",inep,-43.4168765,-22.8809375,2018,18,1
33080070,3304557,0817056 ESCOLA MUNICIPAL ANNA AMELIA QUEIROZ CARNEIRO DE MENDONCA,0,1,0,NA,"RUA BIARRITZ, S/Nº BANGU. 21870-190 Rio de Janeiro - RJ.","RUA BIARRITZ, S/Nº BANGU. 21870-190 Rio de Janeiro - RJ.",inep,"RUA BIARRITZ, S/Nº BANGU. 21870-190 Rio de Janeiro - RJ.",inep,-43.4599571,-22.8720552,2018,37,1
33080372,3304557,0817048 ESCOLA MUNICIPAL ENGENHEIRO JOAO THOME,0,1,0,NA,"RUA CABO JOSE DA CONCEICAO, 135 PADRE MIGUEL. 21720-520 Rio de Janeiro - RJ.","RUA CABO JOSE DA CONCEICAO, 135 PADRE MIGUEL. 21720-520 Rio de Janeiro - RJ.",inep,"RUA CABO JOSE DA CONCEICAO, 135 PADRE MIGUEL. 21720-520 Rio de Janeiro - RJ.",inep,-43.4469605,-22.8671049,2018,55,1
33080763,3304557,0817064 ESCOLA MUNICIPAL MARIETA DA CUNHA DA SILVA,0,1,0,NA,"R DO DESENHISTA, S/Nº VILA ALIANCA. BANGU. 21842-030 Rio de Janeiro - RJ.","R DO DESENHISTA, S/Nº VILA ALIANCA. BANGU. 21842-030 Rio de Janeiro - RJ.",inep,"R DO DESENHISTA, S/Nº VILA ALIANCA. BANGU. 21842-030 Rio de Janeiro - RJ.",inep,-43.4776135,-22.8688168,2018,38,1
33080810,3304557,0817050 ESCOLA MUNICIPAL MOACYR PADILHA,0,1,0,NA,"RUA GENERAL GOMES DE CASTRO, 30 PADRE MIGUEL. 21721-000 Rio de Janeiro - RJ.","RUA GENERAL GOMES DE CASTRO, 30 PADRE MIGUEL. 21721-000 Rio de Janeiro - RJ.",inep,"RUA GENERAL GOMES DE CASTRO, 30 PADRE MIGUEL. 21721-000 Rio de Janeiro - RJ.",inep,-43.4507616,-22.8687072,2018,25,1
33080984,3304557,0833024 ESCOLA MUNICIPAL PRESIDENTE ROOSEVELT,0,1,0,NA,"RUA MARECHAL FALCAO DA FROTA, S/N REALENGO. 21720-020 Rio de Janeiro - RJ.","RUA MARECHAL FALCAO DA FROTA, S/N REALENGO. 21720-020 Rio de Janeiro - RJ.",inep,"RUA MARECHAL FALCAO DA FROTA, S/N REALENGO. 21720-020 Rio de Janeiro - RJ.",inep,-43.4390447,-22.870286,2018,33,1
33081077,3304557,0833026 ESCOLA MUNICIPAL RAMIZ GALVAO,0,1,0,NA,"PRACA RICARDO GONCALVES, S/ N REALENGO. 21750-420 Rio de Janeiro - RJ.","PRACA RICARDO GONCALVES, S/ N REALENGO. 21750-420 Rio de Janeiro - RJ.",inep,"PRACA RICARDO GONCALVES, S/ N REALENGO. 21750-420 Rio de Janeiro - RJ.",inep,-43.4169016,-22.8809583,2018,28,1
33081107,3304557,0833040 ESCOLA MUNICIPAL RONDON,0,1,0,NA,"R CLAUDINO BARATA, 1267 BARATA. REALENGO. 21770-200 Rio de Janeiro - RJ.","R CLAUDINO BARATA, 1267 BARATA. REALENGO. 21770-200 Rio de Janeiro - RJ.",inep,"R CLAUDINO BARATA, 1267 BARATA. REALENGO. 21770-200 Rio de Janeiro - RJ.",inep,-43.4451864,-22.8942435,2018,41,1
33081182,3304557,0833031 ESCOLA MUNICIPAL TASSO DA SILVEIRA,0,1,0,NA,"RUA GAL BERNARDINO DE MATTOS, REALENGO. 21750-480 Rio de Janeiro - RJ.","RUA GAL BERNARDINO DE MATTOS, REALENGO. 21750-480 Rio de Janeiro - RJ.",inep,"RUA GAL BERNARDINO DE MATTOS, REALENGO. 21750-480 Rio de Janeiro - RJ.",inep,-43.4171338,-22.8841159,2018,72,1
33082065,3304557,CE PROFESSOR FELIPE DOS SANTOS REIS,0,0,1,NA,"RUA MARCORAMA, 0 S/N. CAMPO GRANDE. 23068-000 Rio de Janeiro - RJ.","RUA MARCORAMA, 0 S/N. CAMPO GRANDE. 23068-000 Rio de Janeiro - RJ.",inep,"RUA MARCORAMA, 0 S/N. CAMPO GRANDE. 23068-000 Rio de Janeiro - RJ.",inep,-43.6097729,-22.8872913,2018,15,1
33082324,3304557,CE MONTEIRO LOBATO,0,0,1,NA,"ESTRADA DO MATO ALTO, 00 CAMPO GRANDE. 23036-150 Rio de Janeiro - RJ.","ESTRADA DO MATO ALTO, 00 CAMPO GRANDE. 23036-150 Rio de Janeiro - RJ.",inep,"ESTRADA DO MATO ALTO, 00 CAMPO GRANDE. 23036-150 Rio de Janeiro - RJ.",inep,-43.5775072,-22.9529881,2018,24,1
33082359,3304557,CE PROFESSORA JUREMA PECANHA GIRAUD,0,0,1,NA,"RUA ATACAMA, 0 PREDIO ESCOLAR. CAMPO GRANDE. 23078-100 Rio de Janeiro - RJ.","RUA ATACAMA, 0 PREDIO ESCOLAR. CAMPO GRANDE. 23078-100 Rio de Janeiro - RJ.",inep,"RUA ATACAMA, 0 PREDIO ESCOLAR. CAMPO GRANDE. 23078-100 Rio de Janeiro - RJ.",inep,-43.5820519,-22.880016,2018,36,1
33082430,3304557,CE PROFESSOR VIEIRA FAZENDA,0,0,1,NA,"ESTRADA DA BARRA DE GUARATIBA, 9140 BARRA DE GUARATIBA. 23020-240 Rio de Janeiro - RJ.","ESTRADA DA BARRA DE GUARATIBA, 9140 BARRA DE GUARATIBA. 23020-240 Rio de Janeiro - RJ.",inep,"ESTRADA DA BARRA DE GUARATIBA, 9140 BARRA DE GUARATIBA. 23020-240 Rio de Janeiro - RJ.",inep,-43.568289300000004,-23.0610357,2018,23,1
33082545,3304557,0918001 ESCOLA MUNICIPAL ALBA CANIZARES DO NASCIMENTO,0,1,0,NA,"RUA PROFO SOUZA MOREIRA, 301 INHOAIBA. 23059-540 Rio de Janeiro - RJ.","RUA PROFO SOUZA MOREIRA, 301 INHOAIBA. 23059-540 Rio de Janeiro - RJ.",inep,"RUA PROFO SOUZA MOREIRA, 301 INHOAIBA. 23059-540 Rio de Janeiro - RJ.",inep,-43.5956296,-22.9106094,2018,51,1
33082731,3304557,0918071 ESCOLA MUNICIPAL CHARLES DICKENS,0,1,0,NA,"RUA PRIMEIRA CRUZ, SEM Nº CAMPO GRANDE. 23085-710 Rio de Janeiro - RJ.","RUA PRIMEIRA CRUZ, SEM Nº CAMPO GRANDE. 23085-710 Rio de Janeiro - RJ.",inep,"RUA PRIMEIRA CRUZ, SEM Nº CAMPO GRANDE. 23085-710 Rio de Janeiro - RJ.",inep,-43.55784,-22.89423,2018,63,1
33083029,3304557,1026001 ESCOLA MUNICIPAL JONATAS SERRANO,1,1,0,NA,"ESTR DO MATO ALTO, S/Nº GUARATIBA. 23036-150 Rio de Janeiro - RJ.","ESTR DO MATO ALTO, S/Nº GUARATIBA. 23036-150 Rio de Janeiro - RJ.",inep,"ESTR DO MATO ALTO, S/Nº GUARATIBA. 23036-150 Rio de Janeiro - RJ.",inep,-43.57756,-22.95302,2018,96,1
33083266,3304557,0918011 ESCOLA MUNICIPAL PROFESSOR MANOEL MAURICIO,0,1,0,NA,"RUA MARCORAMA SANTA MARGARIDA, CAMPO GRANDE. 23068-000 Rio de Janeiro - RJ.","RUA MARCORAMA SANTA MARGARIDA, CAMPO GRANDE. 23068-000 Rio de Janeiro - RJ.",inep,"RUA MARCORAMA SANTA MARGARIDA, CAMPO GRANDE. 23068-000 Rio de Janeiro - RJ.",inep,-43.6097998,-22.8872927,2018,37,1
33083304,3304557,1026012 ESCOLA MUNICIPAL PROFESSOR VIEIRA FAZENDA,0,1,0,NA,"ESTR.BARRA DE GUARATIBA, 9140 B DE GUARATIBA. BARRA DE GUARATIBA. 23020-240 Rio de Janeiro - RJ.","ESTR.BARRA DE GUARATIBA, 9140 B DE GUARATIBA. BARRA DE GUARATIBA. 23020-240 Rio de Janeiro - RJ.",inep,"ESTR.BARRA DE GUARATIBA, 9140 B DE GUARATIBA. BARRA DE GUARATIBA. 23020-240 Rio de Janeiro - RJ.",inep,-43.5683164,-23.0610063,2018,46,1
33083312,3304557,0918069 ESCOLA MUNICIPAL PROFESSORA JUREMA PECANHA GIRAUD,0,1,0,NA,"RUA ATACAMA, S/N PCA SAO MATHEUS. CAMPO GRANDE. 23078-100 Rio de Janeiro - RJ.","RUA ATACAMA, S/N PCA SAO MATHEUS. CAMPO GRANDE. 23078-100 Rio de Janeiro - RJ.",inep,"RUA ATACAMA, S/N PCA SAO MATHEUS. CAMPO GRANDE. 23078-100 Rio de Janeiro - RJ.",inep,-43.5821,-22.8799,2018,55,1
33083380,3304557,0918020 ESCOLA MUNICIPAL ROSARIA TROTTA,0,1,0,NA,"PCA ROSARIA TROTTA, S/Nº CAMPO GRANDE. 23013-720 Rio de Janeiro - RJ.","PCA ROSARIA TROTTA, S/Nº CAMPO GRANDE. 23013-720 Rio de Janeiro - RJ.",inep,"PCA ROSARIA TROTTA, S/Nº CAMPO GRANDE. 23013-720 Rio de Janeiro - RJ.",inep,-43.5492,-22.9015,2018,67,1
33084025,3304557,CEJA SENAI PACIENCIA,0,1,1,NA,"ESTRADA SANTA EUGENIA, S/N PACIENCIA. 23585-430 Rio de Janeiro - RJ.","ESTRADA SANTA EUGENIA, S/N PACIENCIA. 23585-430 Rio de Janeiro - RJ.",inep,"ESTRADA SANTA EUGENIA, S/N PACIENCIA. 23585-430 Rio de Janeiro - RJ.",inep,-43.6331442,-22.919252,2018,72,1
33084068,3304557,1019206 CIEP BARAO DE ITARARE,1,1,0,NA,"ESTRADA VITOR DUMAS, S/Nº SANTA CRUZ. 23550-140 Rio de Janeiro - RJ.","ESTRADA VITOR DUMAS, S/Nº SANTA CRUZ. 23550-140 Rio de Janeiro - RJ.",inep,"ESTRADA VITOR DUMAS, S/Nº SANTA CRUZ. 23550-140 Rio de Janeiro - RJ.",inep,-43.6961016,-22.9291655,2018,74,1
33084459,3304557,CE PESTALOZZI,0,0,1,NA,"RUA FELIPE CARDOSO FUNDOS, 750 FUNDOS. SANTA CRUZ. 23510-001 Rio de Janeiro - RJ.","RUA FELIPE CARDOSO FUNDOS, 750 FUNDOS. SANTA CRUZ. 23510-001 Rio de Janeiro - RJ.",inep,"RUA FELIPE CARDOSO FUNDOS, 750 FUNDOS. SANTA CRUZ. 23510-001 Rio de Janeiro - RJ.",inep,-43.681,-22.9222,2018,51,1
33084947,3304557,1019001 ESCOLA MUNICIPAL PROFESSOR COQUEIRO,1,1,0,NA,"RUA FELIPE CARDOSO, 750 FUNDOS. SANTA CRUZ. 23510-001 Rio de Janeiro - RJ.","RUA FELIPE CARDOSO, 750 FUNDOS. SANTA CRUZ. 23510-001 Rio de Janeiro - RJ.",inep,"RUA FELIPE CARDOSO, 750 FUNDOS. SANTA CRUZ. 23510-001 Rio de Janeiro - RJ.",inep,-43.68111,-22.9222,2018,58,1
33085811,3304557,CE PROFESSORA MATILDE DE JESUS QUADRADO,0,0,1,NA,"RUA GUSTAVO AUGUSTO DE REZENDE, 541 PORTUGUESA. 21931-576 Rio de Janeiro - RJ.","RUA GUSTAVO AUGUSTO DE REZENDE, 541 PORTUGUESA. 21931-576 Rio de Janeiro - RJ.",inep,"RUA GUSTAVO AUGUSTO DE REZENDE, 541 PORTUGUESA. 21931-576 Rio de Janeiro - RJ.",inep,-43.20716,-22.7995,2018,5,1
33085838,3304557,CE ROTARY,0,0,1,NA,"AVENIDA PARANAPUA, 204 FREGUESIA ILHA DO GOVERNADOR. 21910-003 Rio de Janeiro - RJ.","AVENIDA PARANAPUA, 204 FREGUESIA ILHA DO GOVERNADOR. 21910-003 Rio de Janeiro - RJ.",inep,"AVENIDA PARANAPUA, 204 FREGUESIA ILHA DO GOVERNADOR. 21910-003 Rio de Janeiro - RJ.",inep,-43.1731269,-22.794051,2018,30,1
33086060,3304557,1120021 ESCOLA MUNICIPAL GURGEL DO AMARAL,0,1,0,NA,"RUA GUSTAVO AUGUSTO DE RESENDE, 541 PORTUGUESA. 21931-576 Rio de Janeiro - RJ.","RUA GUSTAVO AUGUSTO DE RESENDE, 541 PORTUGUESA. 21931-576 Rio de Janeiro - RJ.",inep,"RUA GUSTAVO AUGUSTO DE RESENDE, 541 PORTUGUESA. 21931-576 Rio de Janeiro - RJ.",inep,-43.2072017,-22.7996044,2018,38,1
33086176,3304557,1120007 ESCOLA MUNICIPAL ROTARY,0,1,0,NA,"AV PARANAPUAN, 204 FREGUESIA. 21910-003 Rio de Janeiro - RJ.","AV PARANAPUAN, 204 FREGUESIA. 21910-003 Rio de Janeiro - RJ.",inep,"AV PARANAPUAN, 204 FREGUESIA. 21910-003 Rio de Janeiro - RJ.",inep,-43.17309,-22.7939373,2018,38,1
33086540,3304557,CE ACARI,0,0,1,NA,"RUA FAUSTO E CASTRO, 0 PAVUNA. 21535-130 Rio de Janeiro - RJ.","RUA FAUSTO E CASTRO, 0 PAVUNA. 21535-130 Rio de Janeiro - RJ.",inep,"RUA FAUSTO E CASTRO, 0 PAVUNA. 21535-130 Rio de Janeiro - RJ.",inep,-43.3403191,-22.8161265,2018,15,1
33086753,3304557,CE CYRO MONTEIRO,0,0,1,NA,"RUA DO ANTURIO, 31 ANCHIETA. 21625-100 Rio de Janeiro - RJ.","RUA DO ANTURIO, 31 ANCHIETA. 21625-100 Rio de Janeiro - RJ.",inep,"RUA DO ANTURIO, 31 ANCHIETA. 21625-100 Rio de Janeiro - RJ.",inep,-43.4033869,-22.8269678,2018,16,1
33086796,3304557,CE PARAIBA,0,0,1,NA,"ESTRADA MARECHAL ALENCASTRO, 4035 ANCHIETA. 21625-001 Rio de Janeiro - RJ.","ESTRADA MARECHAL ALENCASTRO, 4035 ANCHIETA. 21625-001 Rio de Janeiro - RJ.",inep,"ESTRADA MARECHAL ALENCASTRO, 4035 ANCHIETA. 21625-001 Rio de Janeiro - RJ.",inep,-43.4027508,-22.8264536,2018,14,1
33086990,3304557,0622005 ESCOLA MUNICIPAL CYRO MONTEIRO,0,1,0,NA,"R DO ANTURIO, 31 ANCHIETA. 21625-100 Rio de Janeiro - RJ.","R DO ANTURIO, 31 ANCHIETA. 21625-100 Rio de Janeiro - RJ.",inep,"R DO ANTURIO, 31 ANCHIETA. 21625-100 Rio de Janeiro - RJ.",inep,-43.4033,-22.827,2018,72,1
33087288,3304557,0622004 ESCOLA MUNICIPAL PARAIBA,0,1,0,NA,"ESTR MAL ALENCASTRO, 4035 ANCHIETA. 21625-001 Rio de Janeiro - RJ.","ESTR MAL ALENCASTRO, 4035 ANCHIETA. 21625-001 Rio de Janeiro - RJ.",inep,"ESTR MAL ALENCASTRO, 4035 ANCHIETA. 21625-001 Rio de Janeiro - RJ.",inep,-43.40262699,-22.82648481,2018,71,1
33087750,3304557,CE ALMIRANTE TAMANDARE,0,0,1,NA,"AVENIDA PRESIDENTE JOAO GOULART, 296 VIDIGAL. 22450-242 Rio de Janeiro - RJ.","AVENIDA PRESIDENTE JOAO GOULART, 296 VIDIGAL. 22450-242 Rio de Janeiro - RJ.",inep,"AVENIDA PRESIDENTE JOAO GOULART, 296 VIDIGAL. 22450-242 Rio de Janeiro - RJ.",inep,-43.2357,-22.99365,2018,25,1
33088225,3304557,0625027 ESCOLA MUNICIPAL ANDREA FONTES PEIXOTO,0,1,0,NA,"RUA FAUSTO E CASTRO, SN PARQUE COLUMBIA. 21535-130 Rio de Janeiro - RJ.","RUA FAUSTO E CASTRO, SN PARQUE COLUMBIA. 21535-130 Rio de Janeiro - RJ.",inep,"RUA FAUSTO E CASTRO, SN PARQUE COLUMBIA. 21535-130 Rio de Janeiro - RJ.",inep,-43.3403015,-22.8162188,2018,35,1
33088420,3304557,CE DEBORAH MENDES DE MORAES,0,0,1,NA,"RUA SOLDADO ANTONIO DE PAULA, 00 PEDRA DE GUARATIBA. 23027-260 Rio de Janeiro - RJ.","RUA SOLDADO ANTONIO DE PAULA, 00 PEDRA DE GUARATIBA. 23027-260 Rio de Janeiro - RJ.",inep,"RUA SOLDADO ANTONIO DE PAULA, 00 PEDRA DE GUARATIBA. 23027-260 Rio de Janeiro - RJ.",inep,-43.629323,-23.0041814,2018,15,1
33088489,3304557,0312503 CIEP CORONEL SARMENTO,1,1,0,NA,"AV. ITAOCA, S/Nº INHAUMA. 21061-020 Rio de Janeiro - RJ.","AV. ITAOCA, S/Nº INHAUMA. 21061-020 Rio de Janeiro - RJ.",inep,"AV. ITAOCA, S/Nº INHAUMA. 21061-020 Rio de Janeiro - RJ.",inep,-43.2767931,-22.8726079,2018,63,1
33090653,3304904,CIEP 121 PROFESSOR JOADELIO CODECO,0,1,1,NA,"RODOVIA AMARAL PEIXOTO RJ 104, KM 19, 0 KM 19. MARAMBAIA. 24753-560 São Gonçalo - RJ.","RODOVIA AMARAL PEIXOTO RJ 104, KM 19, 0 KM 19. MARAMBAIA. 24753-560 São Gonçalo - RJ.",inep,"RODOVIA AMARAL PEIXOTO RJ 104, KM 19, 0 KM 19. MARAMBAIA. 24753-560 São Gonçalo - RJ.",inep,-42.9502134,-22.793423,2018,55,1
33095078,3304557,CE BERNARDO DE VASCONCELOS,0,0,1,NA,"PRACA SANTA ROSALIA, 100 PENHA. 21070-440 Rio de Janeiro - RJ.","PRACA SANTA ROSALIA, 100 PENHA. 21070-440 Rio de Janeiro - RJ.",inep,"PRACA SANTA ROSALIA, 100 PENHA. 21070-440 Rio de Janeiro - RJ.",inep,-43.2840088,-22.8455993,2018,24,1
33099227,3301702,CIEP 370 PROFESSOR SYLVIO GNECCO DE CARVALHO,0,1,1,NA,"RUA EUSTAQUIO DE AZEVEDO, 00 VILA MARIA HELENA. 25251-600 Duque de Caxias - RJ.","RUA EUSTAQUIO DE AZEVEDO, 00 VILA MARIA HELENA. 25251-600 Duque de Caxias - RJ.",inep,"RUA EUSTAQUIO DE AZEVEDO, 00 VILA MARIA HELENA. 25251-600 Duque de Caxias - RJ.",inep,-43.2745987,-22.668273,2018,35,1
33100675,3304557,CE RAYMUNDO CORREA,0,0,1,NA,"RUA RODRIGUES DE ABREU, 10 CAMPO GRANDE. 23036-380 Rio de Janeiro - RJ.","RUA RODRIGUES DE ABREU, 10 CAMPO GRANDE. 23036-380 Rio de Janeiro - RJ.",inep,"RUA RODRIGUES DE ABREU, 10 CAMPO GRANDE. 23036-380 Rio de Janeiro - RJ.",inep,-43.5763504,-22.9304652,2018,22,1
33105294,3304557,CIEP 311 DEPUTADO BOCAYUVA CUNHA,0,0,1,NA,"ESTRADA SANTA EUGENIA, 0 PACIENCIA. 23585-430 Rio de Janeiro - RJ.","ESTRADA SANTA EUGENIA, 0 PACIENCIA. 23585-430 Rio de Janeiro - RJ.",inep,"ESTRADA SANTA EUGENIA, 0 PACIENCIA. 23585-430 Rio de Janeiro - RJ.",inep,-43.6331552,-22.9191179,2018,112,1
33117950,3304557,CE PROFESSOR AUGUSTO MOTTA,0,0,1,NA,"RUA BENTO CARDOSO, 140 PENHA CIRCULAR. 21215-000 Rio de Janeiro - RJ.","RUA BENTO CARDOSO, 140 PENHA CIRCULAR. 21215-000 Rio de Janeiro - RJ.",inep,"RUA BENTO CARDOSO, 140 PENHA CIRCULAR. 21215-000 Rio de Janeiro - RJ.",inep,-43.288329,-22.8354666,2018,27,1
