co_entidade,code_muni,no_entidade,mat_infantil,mat_fundamental,mat_medio,nu_funcionarios,endereco,SearchedAddress,PrecisionDepth,MatchedAddress,geocode_engine,lon,lat,year,qt_funcionarios,n
35058208,3550308,CEU CEI VILA ATLANTICA,1,0,0,70,"CORONEL JOSE VENANCIO DIAS, 840 JARAGUA. 05160-030 São Paulo - SP.","CORONEL JOSE VENANCIO DIAS, 840 JARAGUA. 05160-030 São Paulo - SP.",street_number,"R. Cel. José Venâncio Dias, 840 - Jaraguá, São Paulo - SP, 05160-030, Brazil",gmaps_prob1,-46.7626941,-23.4813299,2017,NA,3
35058257,3550308,CEU EMEI APPARECIDO DOMINGUES PROF,1,0,0,61,"MARECHAL TITO, 3400 ITAIM PAULISTA. 08115-000 São Paulo - SP.","MARECHAL TITO, 3400 ITAIM PAULISTA. 08115-000 São Paulo - SP.",street_number,"Avenida Marechal Tito, 3400 - Jardim Dom Fernando, São Paulo - SP, 08160-495, Brazil",gmaps_prob1,-46.4123538,-23.4952913,2017,NA,1
35058464,3550308,CEU EMEI TRES LAGOS,1,0,0,49,"MARIA MOURA DA CONCEICAO, S/N JARDIM BELCITO. 04855-257 São Paulo - SP.","MARIA MOURA DA CONCEICAO, S/N JARDIM BELCITO. 04855-257 São Paulo - SP.",inep,"MARIA MOURA DA CONCEICAO, S/N JARDIM BELCITO. 04855-257 São Paulo - SP.",inep,-46.6806137,-23.7675077,2017,NA,1
35058488,3550308,CEU CEI TRES LAGOS,1,0,0,77,"MARIA MOURA DA CONCEICAO, S/N JARDIM BELCITO. 04855-257 São Paulo - SP.","MARIA MOURA DA CONCEICAO, S/N JARDIM BELCITO. 04855-257 São Paulo - SP.",inep,"MARIA MOURA DA CONCEICAO, S/N JARDIM BELCITO. 04855-257 São Paulo - SP.",inep,-46.6806811,-23.7674138,2017,NA,1
35059389,3509502,REGENTE FEIJO CEI,1,0,0,39,"PEROBAS, 62 RUA. VILA BOA VISTA. 13064-763 Campinas - SP.","PEROBAS, 62 RUA. VILA BOA VISTA. 13064-763 Campinas - SP.",inep,"PEROBAS, 62 RUA. VILA BOA VISTA. 13064-763 Campinas - SP.",inep,-47.1205493,-22.8913458,2017,NA,1
35060331,3550308,CEU EMEF CASA BLANCA,0,1,0,74,"JOAO DAMASCENO, 85 VILA DAS BELEZAS. 05841-160 São Paulo - SP.","JOAO DAMASCENO, 85 VILA DAS BELEZAS. 05841-160 São Paulo - SP.",inep,"JOAO DAMASCENO, 85 VILA DAS BELEZAS. 05841-160 São Paulo - SP.",inep,-46.7444,-23.6467,2017,NA,3
35060549,3550308,CEU EMEI CASA BLANCA,1,0,0,52,"JOAO DAMASCENO, 85 VILA DAS BELEZAS. 05841-160 São Paulo - SP.","JOAO DAMASCENO, 85 VILA DAS BELEZAS. 05841-160 São Paulo - SP.",inep,"JOAO DAMASCENO, 85 VILA DAS BELEZAS. 05841-160 São Paulo - SP.",inep,-46.7445451207894,-23.6467031529393,2017,NA,2
35060550,3550308,CEU CEI CASA BLANCA,1,0,0,91,"JOAO DAMASCENO, 85 VILA DAS BELEZAS. 05841-160 São Paulo - SP.","JOAO DAMASCENO, 85 VILA DAS BELEZAS. 05841-160 São Paulo - SP.",inep,"JOAO DAMASCENO, 85 VILA DAS BELEZAS. 05841-160 São Paulo - SP.",inep,-46.7444,-23.6467,2017,NA,3
35060562,3550308,CEU EMEF HERMES FERREIRA DE SOUZA,0,1,0,78,"CARLOS LACERDA, 678 PIRAJUSSARA. 05789-000 São Paulo - SP.","CARLOS LACERDA, 678 PIRAJUSSARA. 05789-000 São Paulo - SP.",inep,"CARLOS LACERDA, 678 PIRAJUSSARA. 05789-000 São Paulo - SP.",inep,-46.7794,-23.6368,2017,NA,2
35060847,3550308,CEU CEI CAMPO LIMPO,1,0,0,63,"CARLOS LACERDA, 678 PIRAJUSSARA. 05789-000 São Paulo - SP.","CARLOS LACERDA, 678 PIRAJUSSARA. 05789-000 São Paulo - SP.",inep,"CARLOS LACERDA, 678 PIRAJUSSARA. 05789-000 São Paulo - SP.",inep,-46.7794,-23.6368,2017,NA,2
35060948,3550308,CEU EMEI PAZ,1,0,0,45,"DANIEL CERRI, 1549 JARDIM PARANA. 02876-170 São Paulo - SP.","DANIEL CERRI, 1549 JARDIM PARANA. 02876-170 São Paulo - SP.",street_number,"Rua Daniel Cerri, 1549 - Jardim Paraná, São Paulo - SP, 02879-140, Brazil",gmaps_prob1,-46.6888521,-23.4480549,2017,NA,3
35060963,3550308,CEU CEI PAZ,1,0,0,85,"DANIEL CERRI, 1549 JARDIM PARANA. 02876-170 São Paulo - SP.","DANIEL CERRI, 1549 JARDIM PARANA. 02876-170 São Paulo - SP.",street_number,"Rua Daniel Cerri, 1549 - Jardim Paraná, São Paulo - SP, 02879-140, Brazil",gmaps_prob1,-46.6888521,-23.4480549,2017,NA,3
35087397,3518800,EPG - EPG CASIMIRO DE ABREU,1,1,0,26,"RUA ITAGUAI, 85 PICANCO. 07083-220 Guarulhos - SP.","RUA ITAGUAI, 85 PICANCO. 07083-220 Guarulhos - SP.",inep,"RUA ITAGUAI, 85 PICANCO. 07083-220 Guarulhos - SP.",inep,-46.54773,-23.43653,2017,NA,1
35087622,3550308,CEU EMEI BENNO HUBERT STOLLENWERK PE,1,0,0,48,"BARBINOS, 111 SAO JOAO CLIMACO. 04240-110 São Paulo - SP.","BARBINOS, 111 SAO JOAO CLIMACO. 04240-110 São Paulo - SP.",inep,"BARBINOS, 111 SAO JOAO CLIMACO. 04240-110 São Paulo - SP.",inep,-46.5831,-23.6212,2017,NA,1
35090591,3550308,CEU EMEF TEOTONIO VILELA SEN,0,1,0,80,"DANIEL CERRI, 1549 JARDIM PARANA. 02876-170 São Paulo - SP.","DANIEL CERRI, 1549 JARDIM PARANA. 02876-170 São Paulo - SP.",street_number,"Rua Daniel Cerri, 1549 - Jardim Paraná, São Paulo - SP, 02879-140, Brazil",gmaps_prob1,-46.6888521,-23.4480549,2017,NA,3
35092575,3550308,EMEFM ANTONIO ALVES VERISSIMO,0,1,1,108,"MARTINO AROSIO, 81 VILA AURORA. 05186-150 São Paulo - SP.","MARTINO AROSIO, 81 VILA AURORA. 05186-150 São Paulo - SP.",inep,"MARTINO AROSIO, 81 VILA AURORA. 05186-150 São Paulo - SP.",inep,-46.7519978,-23.43424409,2017,NA,1
35095631,3550308,CEU EMEF DOMINGOS RUBINO PROF,0,1,0,61,"CLARA PETRELA, 113 JARDIM SAO ROBERTO. 03978-520 São Paulo - SP.","CLARA PETRELA, 113 JARDIM SAO ROBERTO. 03978-520 São Paulo - SP.",inep,"CLARA PETRELA, 113 JARDIM SAO ROBERTO. 03978-520 São Paulo - SP.",inep,-46.5008,-23.6216,2017,NA,1
35098425,3550308,EMEI NAIR CORREA BUARQUE,1,0,0,38,"SANTA ANGELA, 51 VILA PALMEIRAS. 02727-000 São Paulo - SP.","SANTA ANGELA, 51 VILA PALMEIRAS. 02727-000 São Paulo - SP.",inep,"SANTA ANGELA, 51 VILA PALMEIRAS. 02727-000 São Paulo - SP.",inep,-46.686,-23.4986,2017,NA,1
35121708,3550308,CEU CEI SILVANA APARECIDA TOBIAS PROFA,1,0,0,48,"MANUEL DA MOTA COUTINHO, 293 LAJEADO. 08451-420 São Paulo - SP.","MANUEL DA MOTA COUTINHO, 293 LAJEADO. 08451-420 São Paulo - SP.",inep,"MANUEL DA MOTA COUTINHO, 293 LAJEADO. 08451-420 São Paulo - SP.",inep,-46.400662,-23.5450898,2017,NA,1
35122075,3550308,EMEI JARDIM DA CONQUISTA,1,0,0,41,"RECANTO DOS HUMILDES, 278 CONJUNTO HABITACIONAL RECANTO DOS HUMILD. 05209-000 São Paulo - SP.","RECANTO DOS HUMILDES, 278 CONJUNTO HABITACIONAL RECANTO DOS HUMILD. 05209-000 São Paulo - SP.",inep,"RECANTO DOS HUMILDES, 278 CONJUNTO HABITACIONAL RECANTO DOS HUMILD. 05209-000 São Paulo - SP.",inep,-46.7497,-23.4112,2017,NA,1
35122658,3550308,CEU EMEI EDNA ALVES DE SOUSA PROFA,1,0,0,49,"MANUEL DA MOTA COUTINHO, 293 LAJEADO. 08451-420 São Paulo - SP.","MANUEL DA MOTA COUTINHO, 293 LAJEADO. 08451-420 São Paulo - SP.",inep,"MANUEL DA MOTA COUTINHO, 293 LAJEADO. 08451-420 São Paulo - SP.",inep,-46.4007624,-23.5451707,2017,NA,1
35127012,3509502,PARQUE OZIEL,0,0,1,16,"FAUZE SELHE, SN RESIDENCIAL COSMOS. JARDIM MONTE CRISTO/PARQUE OZIEL. 13049-066 Campinas - SP.","FAUZE SELHE, SN RESIDENCIAL COSMOS. JARDIM MONTE CRISTO/PARQUE OZIEL. 13049-066 Campinas - SP.",inep,"FAUZE SELHE, SN RESIDENCIAL COSMOS. JARDIM MONTE CRISTO/PARQUE OZIEL. 13049-066 Campinas - SP.",inep,-47.0844875,-22.9399569,2017,NA,1
35200013,3550308,EMEI MARIA DAILCE MONTEIRO DA SILVA GOMES PROFA,1,0,0,30,"MARTINO AROSIO, 147 VILA AURORA. 05186-150 São Paulo - SP.","MARTINO AROSIO, 147 VILA AURORA. 05186-150 São Paulo - SP.",inep,"MARTINO AROSIO, 147 VILA AURORA. 05186-150 São Paulo - SP.",inep,-46.7521,-23.4343,2017,NA,1
35204729,3509502,ADAO EMILIANO CEI,1,0,0,14,"ARMANDO A D OTAVIANO, 15 AVENIDA. PARQUE CIDADE CAMPINAS. 13069-003 Campinas - SP.","ARMANDO A D OTAVIANO, 15 AVENIDA. PARQUE CIDADE CAMPINAS. 13069-003 Campinas - SP.",inep,"ARMANDO A D OTAVIANO, 15 AVENIDA. PARQUE CIDADE CAMPINAS. 13069-003 Campinas - SP.",inep,-47.1525585,-22.8426137,2017,NA,1
35204778,3509502,CHA IL SUN CEI,1,0,0,39,"PEROBAS, 62 RUA. VILA BOA VISTA. 13064-763 Campinas - SP.","PEROBAS, 62 RUA. VILA BOA VISTA. 13064-763 Campinas - SP.",inep,"PEROBAS, 62 RUA. VILA BOA VISTA. 13064-763 Campinas - SP.",inep,-47.1204389,-22.8913645,2017,NA,1
35204791,3509502,MARIA CELIA PEREIRA CEI,1,0,0,38,"AV ARMANDO ANTONIO D OTAVIANO, 12 AVENIDA. SAN MARTIN. 13069-003 Campinas - SP.","AV ARMANDO ANTONIO D OTAVIANO, 12 AVENIDA. SAN MARTIN. 13069-003 Campinas - SP.",inep,"AV ARMANDO ANTONIO D OTAVIANO, 12 AVENIDA. SAN MARTIN. 13069-003 Campinas - SP.",inep,-47.15248878,-22.8425764,2017,NA,1
35223141,3550308,EMEF JAIRO DE ALMEIDA PROF,0,1,0,101,"RECANTO DOS HUMILDES, S/N CONJUNTO HABITACIONAL RECANTO DOS HUMILD. 05209-000 São Paulo - SP.","RECANTO DOS HUMILDES, S/N CONJUNTO HABITACIONAL RECANTO DOS HUMILD. 05209-000 São Paulo - SP.",inep,"RECANTO DOS HUMILDES, S/N CONJUNTO HABITACIONAL RECANTO DOS HUMILD. 05209-000 São Paulo - SP.",inep,-46.7502838,-23.4133737,2017,NA,1
35233900,3550308,EMEF THEREZA MACIEL DE PAULA PROFA,0,1,0,116,"JORGE CARLOS DE ALMEIDA, 66 JARDIM SANTO ANDRE. 08390-355 São Paulo - SP.","JORGE CARLOS DE ALMEIDA, 66 JARDIM SANTO ANDRE. 08390-355 São Paulo - SP.",inep,"JORGE CARLOS DE ALMEIDA, 66 JARDIM SANTO ANDRE. 08390-355 São Paulo - SP.",inep,-46.4436666,-23.6320476,2017,NA,2
35238824,3550308,CEI DIRET PALMIRA DOS SANTOS ABRANTE,1,0,0,51,"FRANCISCO DE ALVARENGA, 451 JARDIM MIRIAM. 04417-260 São Paulo - SP.","FRANCISCO DE ALVARENGA, 451 JARDIM MIRIAM. 04417-260 São Paulo - SP.",inep,"FRANCISCO DE ALVARENGA, 451 JARDIM MIRIAM. 04417-260 São Paulo - SP.",inep,-46.6364,-23.6805,2017,NA,1
35242226,3550308,CEU EMEI JORGE AMADO,1,0,0,43,"BERNARDO JOSE DE LORENA, S/N VILA FANTON. 05203-200 São Paulo - SP.","BERNARDO JOSE DE LORENA, S/N VILA FANTON. 05203-200 São Paulo - SP.",route,"R. Bernardo José de Lorena - Perus, São Paulo - SP, 05203-200, Brazil",gmaps_prob1,-46.7513843,-23.4057127,2017,NA,3
35246220,3550308,EMEI ANA MARCHIONE SALLES PROFA,1,0,0,38,"DAS FOLHAGENS, 18 JARDIM POPULAR. 03673-070 São Paulo - SP.","DAS FOLHAGENS, 18 JARDIM POPULAR. 03673-070 São Paulo - SP.",inep,"DAS FOLHAGENS, 18 JARDIM POPULAR. 03673-070 São Paulo - SP.",inep,-46.5105,-23.5191,2017,NA,1
35246360,3550308,CEU EMEF CESAR ARRUDA CASTANHO DEP,0,1,0,75,"NAZIR MIGUEL, 849 JARDIM PAULO VI. 05570-030 São Paulo - SP.","NAZIR MIGUEL, 849 JARDIM PAULO VI. 05570-030 São Paulo - SP.",street_number,"R. Nazir Miguel, 849 - Jardim Paulo VI, São Paulo - SP, 05570-030, Brazil",gmaps_prob1,-46.789162,-23.600767,2017,NA,3
35249828,3550308,CEU EMEF MARIA LISBOA DA SILVA PROFA,0,1,0,54,"CURUMATIM, 201 PARQUE BOA ESPERANCA. 08341-240 São Paulo - SP.","CURUMATIM, 201 PARQUE BOA ESPERANCA. 08341-240 São Paulo - SP.",inep,"CURUMATIM, 201 PARQUE BOA ESPERANCA. 08341-240 São Paulo - SP.",inep,-46.4492,-23.6035,2017,NA,1
35269608,3509502,UEF CPAT CENTRO PUBLICO DE APOIO AO TRABALHADOR,0,1,0,11,"CAMPOS SALLES, 427 CD CPAT - CENTRO PUB. CENTRO. 13010-081 Campinas - SP.","CAMPOS SALLES, 427 CD CPAT - CENTRO PUB. CENTRO. 13010-081 Campinas - SP.",inep,"CAMPOS SALLES, 427 CD CPAT - CENTRO PUB. CENTRO. 13010-081 Campinas - SP.",inep,-47.0551648,-22.9013883,2017,NA,6
35269906,3509502,UEF JOSE ALVES CAMPO GRANDE,0,1,0,43,"MARIO SCOLARI PROFESSOR, SN RUA. CIDADE SATELITE IRIS. 13059-605 Campinas - SP.","MARIO SCOLARI PROFESSOR, SN RUA. CIDADE SATELITE IRIS. 13059-605 Campinas - SP.",inep,"MARIO SCOLARI PROFESSOR, SN RUA. CIDADE SATELITE IRIS. 13059-605 Campinas - SP.",inep,-47.0551646,-22.9013876,2017,NA,6
35271111,3550308,CEU EMEF CONCEICAO APARECIDA DE JESUS PROFA,0,1,0,100,"ERNESTO SOUZA CRUZ, 2171 CIDADE ANTONIO ESTEVAO DE CARVALHO. 08225-380 São Paulo - SP.","ERNESTO SOUZA CRUZ, 2171 CIDADE ANTONIO ESTEVAO DE CARVALHO. 08225-380 São Paulo - SP.",inep,"ERNESTO SOUZA CRUZ, 2171 CIDADE ANTONIO ESTEVAO DE CARVALHO. 08225-380 São Paulo - SP.",inep,-46.457,-23.5218,2017,NA,1
35272541,3509502,UEF PADRE FRANCISCO SILVA,0,1,0,45,"FORNOVO, 440 RUA. VILA CASTELO BRANCO. 13061-274 Campinas - SP.","FORNOVO, 440 RUA. VILA CASTELO BRANCO. 13061-274 Campinas - SP.",inep,"FORNOVO, 440 RUA. VILA CASTELO BRANCO. 13061-274 Campinas - SP.",inep,-47.0551664,-22.9013791,2017,NA,6
35275323,3550308,CEU EMEI PAULO FREIRE PROF,1,0,0,36,"CONDESSA ELISABETH DE ROBIANO, S/N VILA MOREIRA. 03074-000 São Paulo - SP.","CONDESSA ELISABETH DE ROBIANO, S/N VILA MOREIRA. 03074-000 São Paulo - SP.",route,"Av. Condessa Elizabeth de Robiano - Vila Moreira, São Paulo - SP, 03074, Brazil",gmaps_prob1,-46.5611158,-23.5243145,2017,NA,2
35279377,3550308,CEU CEI WALTER DE ANDRADE PROF,1,0,0,50,"CONDESSA ELISABETH DE ROBIANO, S/N VILA MOREIRA. 03074-000 São Paulo - SP.","CONDESSA ELISABETH DE ROBIANO, S/N VILA MOREIRA. 03074-000 São Paulo - SP.",route,"Av. Condessa Elizabeth de Robiano - Vila Moreira, São Paulo - SP, 03074, Brazil",gmaps_prob1,-46.5611158,-23.5243145,2017,NA,2
35283685,3509502,OZIEL ALVES PEREIRA EMEF,0,1,0,112,"FAUZE SELHE, SN RUA. JARDIM MONTE CRISTO/PARQUE OZIEL. 13049-066 Campinas - SP.","FAUZE SELHE, SN RUA. JARDIM MONTE CRISTO/PARQUE OZIEL. 13049-066 Campinas - SP.",inep,"FAUZE SELHE, SN RUA. JARDIM MONTE CRISTO/PARQUE OZIEL. 13049-066 Campinas - SP.",inep,-47.0845637,-22.9400216,2017,NA,1
35284531,3509502,UEF PE JOSE NARCISO VIEIRA EHRENBERG,0,1,0,15,"ROBERTO BUENO TEIXEIRA, SN RUA. JARDIM SAO MARCOS. 13082-255 Campinas - SP.","ROBERTO BUENO TEIXEIRA, SN RUA. JARDIM SAO MARCOS. 13082-255 Campinas - SP.",inep,"ROBERTO BUENO TEIXEIRA, SN RUA. JARDIM SAO MARCOS. 13082-255 Campinas - SP.",inep,-47.0551641,-22.901412,2017,NA,6
35285201,3509502,UEF CASI CENTRO DE ATENDIMENTO SOCIAL INTEGRADA,0,1,0,27,"BEATO MARCELINO CHAMPAGNAT, 16 CD CASA ESCOLA ROSA. VILA JOAQUIM INACIO. 13045-650 Campinas - SP.","BEATO MARCELINO CHAMPAGNAT, 16 CD CASA ESCOLA ROSA. VILA JOAQUIM INACIO. 13045-650 Campinas - SP.",inep,"BEATO MARCELINO CHAMPAGNAT, 16 CD CASA ESCOLA ROSA. VILA JOAQUIM INACIO. 13045-650 Campinas - SP.",inep,-47.0551604,-22.9013959,2017,NA,6
35285274,3509502,UEF EMEF ANALIA FERRAZ DA COSTA COUTO,0,1,0,26,"ITAGIBA, SN RUA. JARDIM AMAZONAS. 13044-420 Campinas - SP.","ITAGIBA, SN RUA. JARDIM AMAZONAS. 13044-420 Campinas - SP.",inep,"ITAGIBA, SN RUA. JARDIM AMAZONAS. 13044-420 Campinas - SP.",inep,-47.0551678,-22.9013864,2017,NA,6
35287945,3509502,UEF JOAO ALVES DOS SANTOS DR,0,1,0,12,"MANOEL THOMAZ, 635 CD EMEF JOAO ALVES D. VILA LUNARDI. 13067-230 Campinas - SP.","MANOEL THOMAZ, 635 CD EMEF JOAO ALVES D. VILA LUNARDI. 13067-230 Campinas - SP.",inep,"MANOEL THOMAZ, 635 CD EMEF JOAO ALVES D. VILA LUNARDI. 13067-230 Campinas - SP.",inep,-47.0551649,-22.9013892,2017,NA,6
35298189,3550308,CEU EMEI IRENE MANKE MARQUES PROFA,1,0,0,44,"DOS METALURGICOS, 1262 CIDADE TIRADENTES. 08471-000 São Paulo - SP.","DOS METALURGICOS, 1262 CIDADE TIRADENTES. 08471-000 São Paulo - SP.",inep,"DOS METALURGICOS, 1262 CIDADE TIRADENTES. 08471-000 São Paulo - SP.",inep,-46.4068,-23.5946,2017,NA,1
35298220,3550308,CEU CEI AZUL DA COR DO MAR,1,0,0,64,"ERNESTO SOUZA CRUZ, 2171 CIDADE ANTONIO ESTEVAO DE CARVALHO. 08225-380 São Paulo - SP.","ERNESTO SOUZA CRUZ, 2171 CIDADE ANTONIO ESTEVAO DE CARVALHO. 08225-380 São Paulo - SP.",inep,"ERNESTO SOUZA CRUZ, 2171 CIDADE ANTONIO ESTEVAO DE CARVALHO. 08225-380 São Paulo - SP.",inep,-46.457,-23.5218,2017,NA,1
35298232,3550308,CEU EMEF FEITICO DA VILA,0,1,1,103,"FEITICO DA VILA, 399 CHACARA SANTA MARIA. 05879-000 São Paulo - SP.","FEITICO DA VILA, 399 CHACARA SANTA MARIA. 05879-000 São Paulo - SP.",inep,"FEITICO DA VILA, 399 CHACARA SANTA MARIA. 05879-000 São Paulo - SP.",inep,-46.7931,-23.6859,2017,NA,2
35298244,3550308,CEU EMEI FEITICO DA VILA,1,0,0,52,"FEITICO DA VILA, 399 CHACARA SANTA MARIA. 05879-000 São Paulo - SP.","FEITICO DA VILA, 399 CHACARA SANTA MARIA. 05879-000 São Paulo - SP.",inep,"FEITICO DA VILA, 399 CHACARA SANTA MARIA. 05879-000 São Paulo - SP.",inep,-46.7931,-23.6859,2017,NA,2
35298268,3550308,CEU EMEF JACANA,0,1,0,86,"FRANCISCA ESPOSITO TONETTI, S/N GUAPIRA. 02276-010 São Paulo - SP.","FRANCISCA ESPOSITO TONETTI, S/N GUAPIRA. 02276-010 São Paulo - SP.",route,"R. Francisca Espósito Tonetti - Vila Nilo, São Paulo - SP, Brazil",gmaps_prob1,-46.5838492,-23.4575564,2017,NA,1
35298281,3550308,CEU CEI JACANA,1,0,0,82,"FRANCISCA ESPOSITO TONETTI, S/N GUAPIRA. 02276-010 São Paulo - SP.","FRANCISCA ESPOSITO TONETTI, S/N GUAPIRA. 02276-010 São Paulo - SP.",route,"R. Francisca Espósito Tonetti - Vila Nilo, São Paulo - SP, Brazil",gmaps_prob1,-46.5838492,-23.4575564,2017,NA,1
35346445,3550308,EMEF JARDIM DA CONQUISTA,0,1,0,51,"RECANTO DOS HUMILDES, S/N CONJUNTO HABITACIONAL RECANTO DOS HUMILD. 05209-000 São Paulo - SP.","RECANTO DOS HUMILDES, S/N CONJUNTO HABITACIONAL RECANTO DOS HUMILD. 05209-000 São Paulo - SP.",inep,"RECANTO DOS HUMILDES, S/N CONJUNTO HABITACIONAL RECANTO DOS HUMILD. 05209-000 São Paulo - SP.",inep,-46.7504,-23.4134,2017,NA,1
35356566,3550308,CEU CEI VILA DO SOL,1,0,0,70,"DOS FUNCIONARIOS PUBLICOS, 369 VILA DO SOL. 04962-000 São Paulo - SP.","DOS FUNCIONARIOS PUBLICOS, 369 VILA DO SOL. 04962-000 São Paulo - SP.",inep,"DOS FUNCIONARIOS PUBLICOS, 369 VILA DO SOL. 04962-000 São Paulo - SP.",inep,-46.7803,-23.7353,2017,NA,2
35356612,3550308,CEU EMEF VILA DO SOL,0,1,0,127,"DOS FUNCIONARIOS PUBLICOS, 369 BLOCO GAMA 2. VILA DO SOL. 04962-000 São Paulo - SP.","DOS FUNCIONARIOS PUBLICOS, 369 BLOCO GAMA 2. VILA DO SOL. 04962-000 São Paulo - SP.",inep,"DOS FUNCIONARIOS PUBLICOS, 369 BLOCO GAMA 2. VILA DO SOL. 04962-000 São Paulo - SP.",inep,-46.7803,-23.7353,2017,NA,2
35356621,3550308,CEU CEI CANTOS DO AMANHECER,1,0,0,52,"CANTOS DO AMANHECER, S/N JARDIM ELEDY. 05856-020 São Paulo - SP.","CANTOS DO AMANHECER, S/N JARDIM ELEDY. 05856-020 São Paulo - SP.",route,"Av. Cantos do Amanhecer - Capao Redondo, São Paulo - SP, 05856-020, Brazil",gmaps_prob1,-46.7859632,-23.6496455,2017,NA,3
35356712,3550308,CEU EMEI CANTOS DO AMANHECER,1,0,0,46,"CANTOS DO AMANHECER, S/N JARDIM ELEDY. 05856-020 São Paulo - SP.","CANTOS DO AMANHECER, S/N JARDIM ELEDY. 05856-020 São Paulo - SP.",route,"Av. Cantos do Amanhecer - Capao Redondo, São Paulo - SP, 05856-020, Brazil",gmaps_prob1,-46.7859632,-23.6496455,2017,NA,3
35356736,3550308,CEU EMEF CANTOS DO AMANHECER,0,1,0,107,"CANTOS DO AMANHECER, S/N JARDIM ELEDY. 05856-020 São Paulo - SP.","CANTOS DO AMANHECER, S/N JARDIM ELEDY. 05856-020 São Paulo - SP.",route,"Av. Cantos do Amanhecer - Capao Redondo, São Paulo - SP, 05856-020, Brazil",gmaps_prob1,-46.7859632,-23.6496455,2017,NA,3
35356803,3550308,CEU EMEI JARDIM PAULISTANO,1,0,0,38,"APARECIDA DO TABOADO, S/N JARDIM PAULISTANO ZONA NORTE. 02814-000 São Paulo - SP.","APARECIDA DO TABOADO, S/N JARDIM PAULISTANO ZONA NORTE. 02814-000 São Paulo - SP.",route,"R. Aparecida do Taboado - Jardim Paulistano (Zona Norte), São Paulo - SP, 02675-031, Brazil",gmaps_prob1,-46.7080975,-23.4591332,2017,NA,1
35356815,3550308,CEU EMEF JARDIM PAULISTANO,0,1,0,84,"APARECIDA DO TABOADO, S/N JARDIM PAULISTANO ZONA NORTE. 02814-000 São Paulo - SP.","APARECIDA DO TABOADO, S/N JARDIM PAULISTANO ZONA NORTE. 02814-000 São Paulo - SP.",route,"R. Aparecida do Taboado - Jardim Paulistano (Zona Norte), São Paulo - SP, 02675-031, Brazil",gmaps_prob1,-46.7080975,-23.4591332,2017,NA,1
35357005,3550308,CEU CEI QUINTA DO SOL,1,0,0,63,"LUIZ IMPARATO, 564 PARQUE CISPER. 03819-160 São Paulo - SP.","LUIZ IMPARATO, 564 PARQUE CISPER. 03819-160 São Paulo - SP.",inep,"LUIZ IMPARATO, 564 PARQUE CISPER. 03819-160 São Paulo - SP.",inep,-46.496,-23.4985,2017,NA,3
35357017,3550308,CEU EMEI BRAZ JAIME ROMANO,1,0,0,37,"LUIZ IMPARATO, 564 PARQUE CISPER. 03819-160 São Paulo - SP.","LUIZ IMPARATO, 564 PARQUE CISPER. 03819-160 São Paulo - SP.",inep,"LUIZ IMPARATO, 564 PARQUE CISPER. 03819-160 São Paulo - SP.",inep,-46.496,-23.4985,2017,NA,3
35357030,3550308,CEU EMEF ROSANGELA RODRIGUES VIEIRA PROFA,0,1,0,123,"LUIZ IMPARATO, 564 PARQUE CISPER. 03819-160 São Paulo - SP.","LUIZ IMPARATO, 564 PARQUE CISPER. 03819-160 São Paulo - SP.",inep,"LUIZ IMPARATO, 564 PARQUE CISPER. 03819-160 São Paulo - SP.",inep,-46.4961177,-23.4985012,2017,NA,3
35357108,3550308,CEU CEI TRES PONTES,1,0,0,62,"CAPACHOS, 400 JARDIM CELIA. 08191-330 São Paulo - SP.","CAPACHOS, 400 JARDIM CELIA. 08191-330 São Paulo - SP.",inep,"CAPACHOS, 400 JARDIM CELIA. 08191-330 São Paulo - SP.",inep,-46.3809075,-23.4786139,2017,NA,1
35357112,3550308,CEU EMEI TRES PONTES,1,0,0,57,"CAPACHOS, 400 JARDIM CELIA. 08191-330 São Paulo - SP.","CAPACHOS, 400 JARDIM CELIA. 08191-330 São Paulo - SP.",inep,"CAPACHOS, 400 JARDIM CELIA. 08191-330 São Paulo - SP.",inep,-46.3809944,-23.4785804,2017,NA,1
35381044,3550308,CEU CEI CAMINHO DO MAR,1,0,0,80,"ENGENHEIRO ARMANDO DE ARRUDA PEREIRA, 5241 VILA DO ENCONTRO. 04325-001 São Paulo - SP.","ENGENHEIRO ARMANDO DE ARRUDA PEREIRA, 5241 VILA DO ENCONTRO. 04325-001 São Paulo - SP.",street_number,"Av. Eng. Armando de Arruda Pereira, 5241 - Vila do Encontro, São Paulo - SP, 04413, Brazil",gmaps_prob1,-46.6354068,-23.6679742,2017,NA,3
35381081,3550308,CEU EMEI CAMINHO DO MAR,1,0,0,45,"ENGENHEIRO ARMANDO DE ARRUDA PEREIRA, 5241 VILA DO ENCONTRO. 04325-001 São Paulo - SP.","ENGENHEIRO ARMANDO DE ARRUDA PEREIRA, 5241 VILA DO ENCONTRO. 04325-001 São Paulo - SP.",street_number,"Av. Eng. Armando de Arruda Pereira, 5241 - Vila do Encontro, São Paulo - SP, 04413, Brazil",gmaps_prob1,-46.6354068,-23.6679742,2017,NA,3
35381111,3550308,CEU EMEF CAMINHO DO MAR,0,1,0,103,"ENGENHEIRO ARMANDO DE ARRUDA PEREIRA, 5241 VILA DO ENCONTRO. 04325-001 São Paulo - SP.","ENGENHEIRO ARMANDO DE ARRUDA PEREIRA, 5241 VILA DO ENCONTRO. 04325-001 São Paulo - SP.",street_number,"Av. Eng. Armando de Arruda Pereira, 5241 - Vila do Encontro, São Paulo - SP, 04413, Brazil",gmaps_prob1,-46.6354068,-23.6679742,2017,NA,3
35386315,3518800,EPG - EPG GLORINHA PIMENTEL,1,1,0,74,"RUA PEDRA LAVADA, 829 CUMBICA. 07182-310 Guarulhos - SP.","RUA PEDRA LAVADA, 829 CUMBICA. 07182-310 Guarulhos - SP.",inep,"RUA PEDRA LAVADA, 829 CUMBICA. 07182-310 Guarulhos - SP.",inep,-46.46229,-23.44323,2017,NA,1
35393277,3550308,CEU EMEF ANTONIO CARLOS ROCHA PROF,0,1,1,81,"CONDESSA ELISABETH DE ROBIANO, S/N VILA MOREIRA. 03074-000 São Paulo - SP.","CONDESSA ELISABETH DE ROBIANO, S/N VILA MOREIRA. 03074-000 São Paulo - SP.",route,"Av. Condessa Elizabeth de Robiano - Vila Moreira, São Paulo - SP, 03074, Brazil",gmaps_prob1,-46.5611158,-23.5243145,2017,NA,2
35396539,3550308,CEU CEI PARQUE BRISTOL,1,0,0,80,"PROFESSOR ARTUR PRIMAVESI, S/N PARQUE BRISTOL. 04177-070 São Paulo - SP.","PROFESSOR ARTUR PRIMAVESI, S/N PARQUE BRISTOL. 04177-070 São Paulo - SP.",route,"R. Prof. Artur Primavesi - Parque Bristol, São Paulo - SP, 04177-070, Brazil",gmaps_prob1,-46.608619,-23.6432952,2017,NA,2
35396588,3550308,CEU EMEI LUCIANA AZEVEDO POMPERMAYER PROFA,1,0,0,43,"PROFESSOR ARTUR PRIMAVESI, S/N PARQUE BRISTOL. 04177-070 São Paulo - SP.","PROFESSOR ARTUR PRIMAVESI, S/N PARQUE BRISTOL. 04177-070 São Paulo - SP.",route,"R. Prof. Artur Primavesi - Parque Bristol, São Paulo - SP, 04177-070, Brazil",gmaps_prob1,-46.608619,-23.6432952,2017,NA,2
35396692,3550308,CEU EMEF MARA CRISTINA TARTAGLIA SENA PROFA,0,1,0,73,"PROFESSOR ARTUR PRIMAVESI, S/N PARQUE BRISTOL. 04177-070 São Paulo - SP.","PROFESSOR ARTUR PRIMAVESI, S/N PARQUE BRISTOL. 04177-070 São Paulo - SP.",route,"R. Prof. Artur Primavesi - Parque Bristol, São Paulo - SP, 04177-070, Brazil",gmaps_prob1,-46.608619,-23.6432952,2017,NA,2
35397088,3550308,CEU CEI PARQUE ANHANGUERA,1,0,0,74,"PEDRO JOSE DE LIMA, 1020 JARDIM ANHANGUERA. 05267-174 São Paulo - SP.","PEDRO JOSE DE LIMA, 1020 JARDIM ANHANGUERA. 05267-174 São Paulo - SP.",street_number,"R. Pedro José de Lima, 1020 - Jardim Jaragua, São Paulo - SP, 05267-174, Brazil",gmaps_prob1,-46.7871379,-23.4397843,2017,NA,2
35397131,3550308,CEU EMEI PARQUE ANHANGUERA,1,0,0,55,"PEDRO JOSE DE LIMA, 1020 JARDIM ANHANGUERA. 05267-174 São Paulo - SP.","PEDRO JOSE DE LIMA, 1020 JARDIM ANHANGUERA. 05267-174 São Paulo - SP.",inep,"PEDRO JOSE DE LIMA, 1020 JARDIM ANHANGUERA. 05267-174 São Paulo - SP.",inep,-46.7872,-23.4399,2017,NA,3
35397271,3550308,CEU EMEF PARQUE ANHANGUERA,0,1,0,92,"PEDRO JOSE DE LIMA, 1020 JARDIM ANHANGUERA. 05267-174 São Paulo - SP.","PEDRO JOSE DE LIMA, 1020 JARDIM ANHANGUERA. 05267-174 São Paulo - SP.",street_number,"R. Pedro José de Lima, 1020 - Jardim Jaragua, São Paulo - SP, 05267-174, Brazil",gmaps_prob1,-46.7871379,-23.4397843,2017,NA,2
35397453,3550308,CEU CEI JAGUARE,1,0,0,61,"KENKITI SHIMOMOTO, 80 JAGUARE. 05347-010 São Paulo - SP.","KENKITI SHIMOMOTO, 80 JAGUARE. 05347-010 São Paulo - SP.",street_number,"Rua Kenkiti Shimomoto, 80 - Jardim Boa Vista (Zona Oeste), Osasco - SP, 05583-000, Brazil",gmaps_prob1,-46.7818644,-23.5740094,2017,NA,1
35397465,3550308,CEU EMEI JAGUARE,1,0,0,40,"KENKITI SHIMOMOTO, 80 JAGUARE. 05347-010 São Paulo - SP.","KENKITI SHIMOMOTO, 80 JAGUARE. 05347-010 São Paulo - SP.",street_number,"Rua Kenkiti Shimomoto, 80 - Jardim Boa Vista (Zona Oeste), Osasco - SP, 05583-000, Brazil",gmaps_prob1,-46.7818644,-23.5740094,2017,NA,1
35397477,3550308,CEU EMEF JAGUARE,0,1,1,71,"KENKITI SHIMOMOTO, 80 JAGUARE. 05347-010 São Paulo - SP.","KENKITI SHIMOMOTO, 80 JAGUARE. 05347-010 São Paulo - SP.",inep,"KENKITI SHIMOMOTO, 80 JAGUARE. 05347-010 São Paulo - SP.",inep,-46.7424,-23.5504,2017,NA,1
35397775,3550308,CEU CEI ALTO ALEGRE,1,0,0,67,"BENTO GUELFI, 1802 JARDIM DA LARANJEIRA ZONA LESTE. 08381-001 São Paulo - SP.","BENTO GUELFI, 1802 JARDIM DA LARANJEIRA ZONA LESTE. 08381-001 São Paulo - SP.",inep,"BENTO GUELFI, 1802 JARDIM DA LARANJEIRA ZONA LESTE. 08381-001 São Paulo - SP.",inep,-46.4271764,-23.6096682,2017,NA,1
35398238,3550308,CEU EMEI ALTO ALEGRE,1,0,0,47,"BENTO GUELFI, S/N JARDIM DA LARANJEIRA ZONA LESTE. 08381-001 São Paulo - SP.","BENTO GUELFI, S/N JARDIM DA LARANJEIRA ZONA LESTE. 08381-001 São Paulo - SP.",inep,"BENTO GUELFI, S/N JARDIM DA LARANJEIRA ZONA LESTE. 08381-001 São Paulo - SP.",inep,-46.4273032,-23.6096448,2017,NA,1
35399474,3550308,CEU CEI UIRAPURU,1,0,0,51,"NAZIR MIGUEL, 849 JARDIM PAULO VI. 05570-030 São Paulo - SP.","NAZIR MIGUEL, 849 JARDIM PAULO VI. 05570-030 São Paulo - SP.",street_number,"R. Nazir Miguel, 849 - Jardim Paulo VI, São Paulo - SP, 05570-030, Brazil",gmaps_prob1,-46.789162,-23.600767,2017,NA,3
